{
  "schema_version": "ferrum.diagnostic_ref.v1",
  "ref": "fd1_1a3c5e7f9b0d2f4a6c8e0b2d4f6a8c0e",
  "namespace": "ferrum",
  "created_at": "2026-09-27T10:17:11.020Z",
  "expires_at": "2026-09-27T10:32:11.020Z",
  "protocol": "http3",
  "status": 503,
  "gateway_error": null,
  "detail_available": true,
  "detail": {
    "error_class": null,
    "body_error_class": null,
    "rejection_phase": null,
    "route_timeout_phase": null,
    "backend_dispatch": "not_dispatched",
    "proxy_id": "orders-api",
    "backend_target": "https://orders.internal:8443",
    "duration_bucket": "lt_10ms",
    "rejection": {
      "source": "gateway",
      "phase": "gateway_closed_h3_upload"
    }
  }
}
